{
  "specversion": "1.0",
  "id": "eec8729b87c1910361ab66bb6db839c540fd98352e6ac2eef9142a07f7744e2d",
  "source": "hermes://twalk.example.com/personas/assistant",
  "type": "fr.linagora.twalk.persona.thinking.emitted.v1",
  "time": "2026-09-17T10:00:02Z",
  "subject": "20be32e73506b9104a6a1bf76fc2d2a15cbd2b8a0a421833be01f865ca9886d0",
  "datacontenttype": "application/json",
  "dataschema": "https://schemas.twalk.dev/cloudevents/v1/persona.thinking.emitted.schema.json",
  "traceparent": "00-4bf92f3577b34da6a3ce929d0e0e4736-00f067aa0ba902b7-01",
  "network": "whatsapp",
  "consent": "granted",
  "data": {
    "persona_id": "assistant",
    "trigger": {
      "event_id": "20be32e73506b9104a6a1bf76fc2d2a15cbd2b8a0a421833be01f865ca9886d0",
      "event_type": "fr.linagora.twalk.inbound.message.received.v1"
    },
    "model": "qwen2.5-32b-instruct"
  }
}
